{
  "id": "00000000-0000-4000-8000-000000000010",
  "document": {
    "metadata": {
      "title": "Spring Boot 실습보고서",
      "author": "김예찬",
      "course": "SKALA Backend",
      "date": "2026-08-06"
    },
    "sections": []
  },
  "templateId": "modern",
  "templateVersion": 1,
  "presentationSettings": {
    "accentColor": "#2563eb",
    "showPageNumbers": true
  },
  "version": 3,
  "updatedAt": "2026-08-10T09:00:00+09:00"
}
